{
  "schema_version": "foi-o.bounded-pilot-attachment-stderr-diagnostic-result.v0.1.0",
  "result_id": "bounded-pilot-11872-attachment-stderr-diagnostic-1",
  "status": "completed_local_diagnostic_review_required",
  "repository_commit": "b6fa258e2f4ef10d2bee18c0f0de260657cb3a21",
  "authorization": {"path": "examples/v2/bounded-pilot-attachment-diagnostic-execution-authorization.approved.json", "sha256": "7746b3d03e6ca33ac0407bbcc1c676d5b7c6154761711f891ad2e9ecff3df2b6"},
  "diagnostic_request": {"path": "examples/v2/bounded-pilot-attachment-stderr-diagnostic-request.pending.json", "sha256": "b8c16f51f86b4d1a462edf495dc309f4f6e1dd09c47fb55010a5d08955c40d7f"},
  "wrapper": {"path": "src/foi_o_nz/bounded_pilot_attachment_derivation.py", "sha256": "6d18c3c7a9c16c327fc934a516666d4dfc7d86a2e057824bfbd3eea79a6f7659"},
  "pre_execution_verifier_passed": true,
  "diagnostic_reproduction_complete": true,
  "observations": {
    "attempt_count": 6,
    "successful_return_count": 6,
    "stderr_emitting_attempt_count": 2,
    "stderr_source_index": 2,
    "stderr_source_sha256": "1d1c9eda958de560abea6285182ed6f4ae747944cabfc6bc7485f5707adec79d",
    "stderr_byte_count_per_emitting_attempt": 198,
    "stderr_sha256": "4292a8a1578cd877480338e34585df6aa922afab07bf87f68141173018973b2f",
    "stderr_fingerprint_reproduced_across_passes": true,
    "stderr_content_reviewed": false
  },
  "quarantine": {
    "path": "/private/tmp/.foio-attachment-diagnostic-zdnisebu",
    "directory_mode": "0700",
    "metadata_mode": "0600",
    "stderr_mode": "0600",
    "metadata_sha256": "67b4a9f50c0304b675a94cb0742b14e032de5f6442e37bcc21153b214dc310d6",
    "stderr_file_count": 2,
    "local_only": true,
    "content_committed": false
  },
  "postflight": {
    "output_directory_present": false,
    "temporary_workspaces_present": false,
    "derived_text_retained": false,
    "repository_clean": true
  },
  "warning_policy_determined": false,
  "derivation_retry_authorized": false,
  "context_presentation_allowed": false,
  "analyst_execution_allowed": false,
  "reconciliation_allowed": false,
  "empirical_evidence": false,
  "human_reviewed": false,
  "gold_eligible": false
}
